{"contract_version":"1.0.0","cycle_id":"cycle-1","editor_id":"editor-42","video_type":"short-form","monday_board_id":"board-1","monday_item_id":"item-1","start_status":"In Progress","end_status":"Ready For Approval","in_progress_event_id":"event-100","ready_for_approval_event_id":"event-101","in_progress_at":"2026-09-01T09:00:00Z","ready_for_approval_at":"2026-09-01T11:00:00Z","duration_seconds":7200,"requested_eta":"2026-09-01T11:30:00Z","revision_context":{"count":3}}
